{"latest_version":"1.2.3","latest_version_key":"1.2.3","package_id":"example/family","schema_version":"1","versions":[{"published_at":"2026-01-02T00:00:00Z","url":"/v1/packages/example/family/versions/1.2.3.json","version":"1.2.3","version_key":"1.2.3"},{"published_at":"2026-01-01T00:00:00Z","url":"/v1/packages/example/family/versions/1.2.2.json","version":"1.2.2","version_key":"1.2.2"}]}
